{
    "schemaVersion": 1,
    "title": "Auth",
    "author": {
        "github": "hugozhu",
        "displayName": "hugozhu"
    },
    "links": {
        "github": "https://github.com/hugozhu/streamlit-auth",
        "pypi": "streamlit-auth",
        "demo": null,
        "docs": null
    },
    "media": {
        "image": null
    },
    "install": {
        "pip": "pip install streamlit-auth"
    },
    "governance": {
        "enabled": true,
        "notes": null
    },
    "categories": [
        "Authentication"
    ]
}
